{
  "$schema": "https://json-schema.org/draft/2020-12/schema",
  "title": "Learning Claim Activation Report",
  "type": "object",
  "additionalProperties": false,
  "required": [
    "$schema",
    "artifact_kind",
    "generated_at",
    "producer",
    "source_command",
    "source_revision",
    "source_tree_fingerprint",
    "input_fingerprints",
    "schema_version",
    "artifact_status",
    "retention_policy",
    "encoding",
    "currentness",
    "vault",
    "policy",
    "status",
    "summary",
    "claim_candidate",
    "blocked_predicates",
    "evidence_digests",
    "post_seal_linkage",
    "anti_slop_preview_ledger",
    "negative_learning_ledger"
  ],
  "properties": {
    "$schema": {
      "type": "string",
      "enum": ["ops/schemas/learning-claim-activation-report.schema.json"]
    },
    "artifact_kind": {
      "type": "string",
      "enum": ["learning_claim_activation_report"]
    },
    "generated_at": {
      "type": "string",
      "pattern": "^\\d{4}-\\d{2}-\\d{2}T\\d{2}:\\d{2}:\\d{2}Z$"
    },
    "producer": {
      "type": "string",
      "enum": ["ops.scripts.learning_claim_activation_report"]
    },
    "source_command": { "type": "string", "minLength": 1 },
    "source_revision": { "type": "string", "minLength": 1 },
    "source_tree_fingerprint": { "type": "string", "minLength": 1 },
    "input_fingerprints": {
      "type": "object",
      "additionalProperties": { "type": "string", "minLength": 1 }
    },
    "schema_version": { "type": "integer", "minimum": 1 },
    "artifact_status": {
      "type": "string",
      "enum": ["current", "archived", "stale", "unknown"]
    },
    "retention_policy": {
      "type": "string",
      "enum": ["canonical_report"]
    },
    "encoding": {
      "type": "string",
      "enum": ["utf-8"]
    },
    "currentness": { "$ref": "#/$defs/currentness" },
    "vault": { "type": "string" },
    "policy": { "$ref": "#/$defs/policy_identity" },
    "status": {
      "type": "string",
      "enum": ["pass", "attention"]
    },
    "summary": {
      "type": "object",
      "additionalProperties": false,
      "required": [
        "activation_status",
        "claim_level",
        "claim_wording_allowed",
        "blocked_predicate_count",
        "anti_slop_preview_status",
        "negative_learning_pattern_count",
        "gate_effect"
      ],
      "properties": {
        "activation_status": {
          "type": "string",
          "enum": ["open", "blocked", "not_candidate"]
        },
        "claim_level": { "type": "string" },
        "claim_wording_allowed": { "type": "boolean" },
        "blocked_predicate_count": { "type": "integer", "minimum": 0 },
        "anti_slop_preview_status": { "type": "string" },
        "negative_learning_pattern_count": { "type": "integer", "minimum": 0 },
        "gate_effect": { "type": "string", "enum": ["none"] }
      }
    },
    "claim_candidate": { "$ref": "#/$defs/claim_candidate" },
    "blocked_predicates": {
      "type": "array",
      "items": { "$ref": "#/$defs/blocked_predicate" }
    },
    "evidence_digests": {
      "type": "array",
      "items": { "$ref": "#/$defs/evidence_digest" }
    },
    "post_seal_linkage": { "$ref": "#/$defs/post_seal_linkage" },
    "anti_slop_preview_ledger": { "$ref": "#/$defs/anti_slop_preview_ledger" },
    "negative_learning_ledger": { "$ref": "#/$defs/negative_learning_ledger" }
  },
  "$defs": {
    "currentness": {
      "type": "object",
      "additionalProperties": false,
      "required": ["status", "checked_at"],
      "properties": {
        "status": {
          "type": "string",
          "enum": ["current", "stale", "unknown", "invalid"]
        },
        "checked_at": {
          "type": "string",
          "pattern": "^\\d{4}-\\d{2}-\\d{2}T\\d{2}:\\d{2}:\\d{2}Z$"
        }
      }
    },
    "policy_identity": {
      "type": "object",
      "additionalProperties": false,
      "required": ["path", "version"],
      "properties": {
        "path": { "type": "string" },
        "version": { "type": ["integer", "string", "null"] }
      }
    },
    "evidence_digest": {
      "type": "object",
      "additionalProperties": false,
      "required": ["path", "exists", "sha256", "status"],
      "properties": {
        "path": { "type": "string" },
        "exists": { "type": "boolean" },
        "sha256": { "type": "string", "pattern": "^(|[a-f0-9]{64})$" },
        "status": { "type": "string", "enum": ["present", "missing"] }
      }
    },
    "post_seal_linkage": {
      "type": "object",
      "additionalProperties": false,
      "required": [
        "path",
        "exists",
        "sha256",
        "status",
        "attestation_status",
        "claim_level",
        "learning_claim_evidence_bundle_sha256",
        "post_seal_verified"
      ],
      "properties": {
        "path": { "type": "string" },
        "exists": { "type": "boolean" },
        "sha256": { "type": "string", "pattern": "^(|[a-f0-9]{64})$" },
        "status": { "type": "string", "enum": ["present", "missing"] },
        "attestation_status": { "type": "string" },
        "claim_level": { "type": "string" },
        "learning_claim_evidence_bundle_sha256": {
          "type": "string",
          "pattern": "^(|[a-f0-9]{64})$"
        },
        "post_seal_verified": { "type": "boolean" }
      }
    },
    "claim_candidate": {
      "type": "object",
      "additionalProperties": false,
      "required": [
        "status",
        "candidate",
        "current",
        "required",
        "repair_target",
        "evidence_digest",
        "post_seal_linkage"
      ],
      "properties": {
        "status": { "type": "string", "enum": ["open", "blocked", "not_candidate"] },
        "candidate": { "type": "boolean" },
        "current": {
          "type": "object",
          "additionalProperties": false,
          "required": [
            "claim_level",
            "learning_likely",
            "claims_learning_improved",
            "learning_claim_allowed",
            "bounded_learning_claim_allowed",
            "confirmed_learning_improvement_allowed",
            "claim_wording_allowed",
            "claim_wording_policy_status",
            "learning_claim_evidence_complete"
          ],
          "properties": {
            "claim_level": { "type": "string" },
            "learning_likely": { "type": "boolean" },
            "claims_learning_improved": { "type": "boolean" },
            "learning_claim_allowed": { "type": "boolean" },
            "bounded_learning_claim_allowed": { "type": "boolean" },
            "confirmed_learning_improvement_allowed": { "type": "boolean" },
            "claim_wording_allowed": { "type": "boolean" },
            "claim_wording_policy_status": { "type": "string" },
            "learning_claim_evidence_complete": { "type": "boolean" }
          }
        },
        "required": {
          "type": "object",
          "additionalProperties": false,
          "required": ["bounded_learning_likely", "confirmed_learning_improvement"],
          "properties": {
            "bounded_learning_likely": { "type": "string" },
            "confirmed_learning_improvement": { "type": "string" }
          }
        },
        "repair_target": { "type": "string" },
        "evidence_digest": { "$ref": "#/$defs/evidence_digest" },
        "post_seal_linkage": {
          "type": "object",
          "additionalProperties": false,
          "required": ["path", "sha256", "post_seal_verified"],
          "properties": {
            "path": { "type": "string" },
            "sha256": { "type": "string", "pattern": "^(|[a-f0-9]{64})$" },
            "post_seal_verified": { "type": "boolean" }
          }
        }
      }
    },
    "blocked_predicate": {
      "type": "object",
      "additionalProperties": false,
      "required": [
        "id",
        "status",
        "source",
        "source_path",
        "current",
        "required",
        "repair_target",
        "summary",
        "evidence_digest",
        "post_seal_linkage"
      ],
      "properties": {
        "id": { "type": "string", "minLength": 1 },
        "status": { "type": "string", "minLength": 1 },
        "source": { "type": "string", "minLength": 1 },
        "source_path": { "type": "string" },
        "current": { "type": "string" },
        "required": { "type": "string" },
        "repair_target": { "type": "string", "minLength": 1 },
        "summary": { "type": "string" },
        "evidence_digest": { "$ref": "#/$defs/evidence_digest" },
        "post_seal_linkage": {
          "type": "object",
          "additionalProperties": false,
          "required": ["path", "sha256", "linked"],
          "properties": {
            "path": { "type": "string" },
            "sha256": { "type": "string", "pattern": "^(|[a-f0-9]{64})$" },
            "linked": { "type": "boolean" }
          }
        }
      }
    },
    "anti_slop_preview_ledger": {
      "type": "object",
      "additionalProperties": false,
      "required": [
        "mode",
        "gate_effect",
        "status",
        "scoreboard_anti_slop_status",
        "scoreboard_anti_slop_score",
        "axes"
      ],
      "properties": {
        "mode": { "type": "string", "enum": ["preview"] },
        "gate_effect": { "type": "string", "enum": ["none"] },
        "status": { "type": "string", "enum": ["clean", "attention"] },
        "scoreboard_anti_slop_status": { "type": "string" },
        "scoreboard_anti_slop_score": { "type": "integer", "minimum": 0 },
        "axes": {
          "type": "array",
          "minItems": 6,
          "maxItems": 6,
          "items": { "$ref": "#/$defs/anti_slop_axis" }
        }
      }
    },
    "anti_slop_axis": {
      "type": "object",
      "additionalProperties": false,
      "required": ["axis", "status", "current", "required", "repair_target", "gate_effect"],
      "properties": {
        "axis": {
          "type": "string",
          "enum": [
            "claim_hygiene",
            "evidence_density",
            "reproducibility",
            "scope_discipline",
            "context_efficiency",
            "operator_override_pressure"
          ]
        },
        "status": { "type": "string", "enum": ["pass", "warn", "backlog"] },
        "current": { "type": "string" },
        "required": { "type": "string" },
        "repair_target": { "type": "string" },
        "gate_effect": { "type": "string", "enum": ["none", "advisory"] },
        "retirement_condition": { "type": "string" }
      }
    },
    "negative_learning_ledger": {
      "type": "object",
      "additionalProperties": false,
      "required": ["mode", "gate_effect", "status", "pattern_count", "patterns"],
      "properties": {
        "mode": { "type": "string", "enum": ["advisory"] },
        "gate_effect": { "type": "string", "enum": ["none"] },
        "status": { "type": "string", "enum": ["clean", "attention"] },
        "pattern_count": { "type": "integer", "minimum": 0 },
        "patterns": {
          "type": "array",
          "items": { "$ref": "#/$defs/negative_learning_pattern" }
        }
      }
    },
    "negative_learning_pattern": {
      "type": "object",
      "additionalProperties": false,
      "required": [
        "pattern_id",
        "decisions",
        "run_ids",
        "occurrence_count",
        "forbidden_repeat",
        "repair_target",
        "evidence_digests"
      ],
      "properties": {
        "pattern_id": { "type": "string", "pattern": "^[a-z0-9_]+$" },
        "decisions": {
          "type": "array",
          "items": { "type": "string", "enum": ["HOLD", "DISCARD", "BLOCKED"] }
        },
        "run_ids": {
          "type": "array",
          "items": { "type": "string" }
        },
        "occurrence_count": { "type": "integer", "minimum": 1 },
        "forbidden_repeat": { "type": "string", "minLength": 1 },
        "repair_target": { "type": "string", "minLength": 1 },
        "evidence_digests": {
          "type": "array",
          "items": { "$ref": "#/$defs/evidence_digest" }
        }
      }
    }
  }
}
