{
  "$schema": "ops/schemas/learning-claim-activation-report.schema.json",
  "artifact_kind": "learning_claim_activation_report",
  "generated_at": "2026-05-20T06:30:17Z",
  "producer": "ops.scripts.learning_claim_activation_report",
  "source_command": "python -m ops.scripts.learning_claim_activation_report --vault .",
  "source_revision": "unknown",
  "source_tree_fingerprint": "0e67431e6cdb000e926d05c5652c74a014fce76a336a077f5f25c2f96d26095a",
  "input_fingerprints": {
    "policy": "9d4ebed9b08cd4c9340a88a7d8cfefe17e2a46f7e63711418e4d6057f5b967d3",
    "schema": "d366a06d6c9fbade9f99a3a702f7e88409d8e793328122ab6b196c4d7d670305",
    "artifact_envelope_schema": "87fcb7b91ffc04e8180c1c3e51e309cde186ecf23f91f7974a541d0b580976de",
    "source_paths": "dacdaf0814200d85ea19b48020b2b4fc37138c2de5e4969ffef772480063bbd0",
    "learning_claim_activation_inputs": "0c98e3a12bd5561b01deff71d074f90a1e4e85b71754a11734707f55ce6922d2"
  },
  "schema_version": 1,
  "artifact_status": "current",
  "retention_policy": "canonical_report",
  "encoding": "utf-8",
  "currentness": {
    "status": "current",
    "checked_at": "2026-05-20T06:30:17Z"
  },
  "vault": ".",
  "policy": {
    "path": "ops/policies/wiki-maintainer-policy.yaml",
    "version": 4
  },
  "status": "pass",
  "summary": {
    "activation_status": "blocked",
    "claim_level": "none",
    "claim_wording_allowed": false,
    "blocked_predicate_count": 1,
    "anti_slop_preview_status": "attention",
    "negative_learning_pattern_count": 4,
    "gate_effect": "none"
  },
  "claim_candidate": {
    "status": "blocked",
    "candidate": true,
    "current": {
      "claim_level": "none",
      "learning_likely": true,
      "claims_learning_improved": false,
      "learning_claim_allowed": false,
      "bounded_learning_claim_allowed": false,
      "confirmed_learning_improvement_allowed": false,
      "claim_wording_allowed": false,
      "claim_wording_policy_status": "blocked",
      "learning_claim_evidence_complete": true
    },
    "required": {
      "bounded_learning_likely": "learning_claim_allowed == true with full same-eval reason, strict-secondary, behavior-delta digest, placeholder-free external report, and approved unlock review",
      "confirmed_learning_improvement": "confirmed evidence cohort, active evidence bundle, clean full/public/revalidation evidence, no learning blockers, and post-seal attestation authority"
    },
    "repair_target": "Approve or auto-approve the unlock review only after evidence bundle, readiness, and review items are current and clean.",
    "evidence_digest": {
      "path": "ops/reports/learning-delta-scoreboard.json",
      "exists": true,
      "sha256": "ae61479554ae5332d7712891adc4504b29dc73b20aa6bd301feea9e51dc08f53",
      "status": "present"
    },
    "post_seal_linkage": {
      "path": "build/release/release-post-seal-attestation.json",
      "sha256": "969b5f0ceba4f683fa31ac06fa544b6ad163314646320826cde201da6ac6e6a6",
      "post_seal_verified": true
    }
  },
  "blocked_predicates": [
    {
      "id": "learning_claim_unlock_review_not_approved",
      "status": "stale",
      "source": "learning_delta_scoreboard.learning_claim_unlock_review",
      "source_path": "ops/reports/learning-delta-scoreboard.json",
      "current": "approved=False; status=stale",
      "required": "learning_claim_unlock_review.approved == true",
      "repair_target": "Approve or auto-approve the unlock review only after evidence bundle, readiness, and review items are current and clean.",
      "summary": "learning claim auto approval is no longer active for the current evidence bundle: learning claim evidence bundle digest no longer matches current evidence",
      "evidence_digest": {
        "path": "ops/reports/learning-delta-scoreboard.json",
        "exists": true,
        "sha256": "ae61479554ae5332d7712891adc4504b29dc73b20aa6bd301feea9e51dc08f53",
        "status": "present"
      },
      "post_seal_linkage": {
        "path": "build/release/release-post-seal-attestation.json",
        "sha256": "969b5f0ceba4f683fa31ac06fa544b6ad163314646320826cde201da6ac6e6a6",
        "linked": true
      }
    }
  ],
  "evidence_digests": [
    {
      "path": "ops/reports/auto-improve-readiness.json",
      "exists": true,
      "sha256": "747d61c9f926abedfe53feac044b0e559193a4daf658f53077f9cf628c5ec3eb",
      "status": "present"
    },
    {
      "path": "ops/reports/learning-delta-scoreboard.json",
      "exists": true,
      "sha256": "ae61479554ae5332d7712891adc4504b29dc73b20aa6bd301feea9e51dc08f53",
      "status": "present"
    },
    {
      "path": "ops/reports/learning-claim-unlock-review.json",
      "exists": true,
      "sha256": "5998bc4e4ac84df4a9e71e6a54efc8e8883e25b0bb7964169b870a872b2e8e0c",
      "status": "present"
    },
    {
      "path": "ops/reports/learning-claim-evidence-bundle.json",
      "exists": true,
      "sha256": "886901cf0d5ac77d3eff235bb33d6eb063e7c62f3c691dafbbf7f8fc8472f802",
      "status": "present"
    },
    {
      "path": "ops/reports/release-clean-blocker-ledger.json",
      "exists": true,
      "sha256": "21607147e6fbbe69e7ebf8d32c13c4b0e82ff2757bda0b00c0005f29ac5f8854",
      "status": "present"
    },
    {
      "path": "ops/reports/source-package-clean-extract.json",
      "exists": true,
      "sha256": "dd906c540c08d9f3ff8d34d77a9fa8e470628b59ee13794fb95ce547a05af26d",
      "status": "present"
    },
    {
      "path": "build/release/release-post-seal-attestation.json",
      "exists": true,
      "sha256": "969b5f0ceba4f683fa31ac06fa544b6ad163314646320826cde201da6ac6e6a6",
      "status": "present"
    }
  ],
  "post_seal_linkage": {
    "path": "build/release/release-post-seal-attestation.json",
    "exists": true,
    "sha256": "969b5f0ceba4f683fa31ac06fa544b6ad163314646320826cde201da6ac6e6a6",
    "status": "present",
    "attestation_status": "pass",
    "claim_level": "none",
    "learning_claim_evidence_bundle_sha256": "4e6118c540721a799ba27accd51368eb9a9807017450d1dbc411af97d293e35a",
    "post_seal_verified": true
  },
  "anti_slop_preview_ledger": {
    "mode": "preview",
    "gate_effect": "none",
    "status": "attention",
    "scoreboard_anti_slop_status": "clean",
    "scoreboard_anti_slop_score": 100,
    "axes": [
      {
        "axis": "claim_hygiene",
        "status": "pass",
        "current": "claim_level=none; claim_wording_allowed=False",
        "required": "No learning-improvement wording unless the claim model allows it.",
        "repair_target": "Keep claim_level=none or complete the unlock and confirmed-claim predicates.",
        "gate_effect": "none"
      },
      {
        "axis": "evidence_density",
        "status": "pass",
        "current": "telemetry=full; same_eval_reason=full; strict_secondary=full; behavior_delta_digest=full",
        "required": "Same-eval learning claims require full telemetry, reason, strict-secondary, and digest coverage.",
        "repair_target": "Backfill missing telemetry or keep the claim closed.",
        "gate_effect": "none"
      },
      {
        "axis": "reproducibility",
        "status": "pass",
        "current": "source_package_clean_extract=pass; evidence_bundle_revocation=active",
        "required": "Source package replay and active evidence bundle must remain reproducible.",
        "repair_target": "Rerun release-source-package-check and learning-claim-evidence-bundle.",
        "gate_effect": "none"
      },
      {
        "axis": "scope_discipline",
        "status": "pass",
        "current": "runnable_proposal_count=1; can_execute_trial=True",
        "required": "Auto-improve learning probes should remain narrow, with at most one runnable proposal.",
        "repair_target": "Split or defer proposals until the active run has a single bounded target.",
        "gate_effect": "none"
      },
      {
        "axis": "context_efficiency",
        "status": "warn",
        "current": "no dedicated context-efficiency telemetry is bound to the learning claim lane",
        "required": "Claim activation should expose context budget or synopsis reuse pressure before promotion authority uses it.",
        "repair_target": "Add context budget telemetry or a session synopsis digest before making this axis gating.",
        "gate_effect": "none"
      },
      {
        "axis": "operator_override_pressure",
        "status": "pass",
        "current": "unlock_review_status=auto_approved; approved=True",
        "required": "Manual override pressure should stay explicit and should not silently unlock claim wording.",
        "repair_target": "Keep review_status required until machine policy and operator signoff are clean.",
        "gate_effect": "none"
      }
    ]
  },
  "negative_learning_ledger": {
    "mode": "advisory",
    "gate_effect": "none",
    "status": "attention",
    "pattern_count": 4,
    "patterns": [
      {
        "pattern_id": "blocked_queue_recent_log_overlap",
        "decisions": [
          "BLOCKED"
        ],
        "run_ids": [],
        "occurrence_count": 1,
        "forbidden_repeat": "Do not repeat this run shape until the repair target is completed.",
        "repair_target": "Resolve queue blocked reason recent_log_overlap before rerunning the same proposal lane.",
        "evidence_digests": [
          {
            "path": "ops/reports/auto-improve-readiness.json",
            "exists": true,
            "sha256": "747d61c9f926abedfe53feac044b0e559193a4daf658f53077f9cf628c5ec3eb",
            "status": "present"
          }
        ]
      },
      {
        "pattern_id": "discard_behavior_delta_before_after_evidence_missing",
        "decisions": [
          "DISCARD"
        ],
        "run_ids": [
          "run-20260507-auto-improve-iteration-persistence-typed-same-eval"
        ],
        "occurrence_count": 1,
        "forbidden_repeat": "Do not repeat this run shape until the repair target is completed.",